{
  "schema": "axis.development-watchdog.control",
  "schema_version": "1.0.0",
  "cron_generation": 1,
  "cron_job_id": null,
  "interval_seconds": 300,
  "heartbeat_grace_seconds": 660,
  "supervisor_worker_freshness_seconds": 1800,
  "delivery_freshness_seconds": 900,
  "outbox_queued_max_age_seconds": 600,
  "outbox_sending_max_age_seconds": 180,
  "outbox_accepted_max_age_seconds": 180,
  "outbox_permanent_attempts": 5,
  "external_monitor_freshness_seconds": 1200,
  "stuck_floor_seconds": 1800,
  "stuck_ceiling_seconds": 21600,
  "stuck_history_multiplier": 3.0,
  "diagnostic_provider": "openai-api",
  "diagnostic_model": "gpt-5.4",
  "diagnostic_reasoning": "medium",
  "diagnostic_timeout_seconds": 90,
  "diagnostic_max_prompt_bytes": 32768,
  "diagnostic_daily_limit": 12,
  "diagnostic_cooldown_seconds": 3600,
  "repair_repository": "cdenneen/home"
}
